{"schema_id":"health_bridge.batch.v1","schema_version":"1.0.0","generated_at":"2026-06-08T09:00:00Z","export_window":{"start_time":"2026-06-01T00:00:00Z","end_time":"2026-06-08T00:00:00Z"},"sources":[{"source_key":"synthetic.phone.alpha","name":"Synthetic Phone Alpha","kind":"phone","bundle_id":"com.example.synthetic.healthbridge","device_model":"SyntheticPhone1,1"}],"health_types":[{"type_code":"steps","display_name":"Steps","category":"activity","default_unit":"count","sensitivity":"low","aliases":["HKQuantityTypeIdentifierStepCount"]}],"samples":[{"client_record_id":"synthetic-sample-steps-20260601","source_key":"synthetic.phone.alpha","type_code":"steps","start_time":"2026-06-01T00:00:00Z","end_time":"2026-06-02T00:00:00Z","value":4321,"unit":"count","metadata":{"aggregation":"daily_sum"}}],"workouts":[{"client_record_id":"synthetic-workout-walk-20260603","source_key":"synthetic.watch.bravo","workout_type":"walking","start_time":"2026-06-03T18:00:00Z","end_time":"2026-06-03T18:32:00Z","duration_seconds":1920,"energy_kcal":140.5,"distance_meters":2400}],"sleep_sessions":[{"client_record_id":"synthetic-sleep-20260604","source_key":"synthetic.watch.bravo","start_time":"2026-06-04T03:10:00Z","end_time":"2026-06-04T10:45:00Z","stage_intervals":[{"stage":"in_bed","start_time":"2026-06-04T03:10:00Z","end_time":"2026-06-04T03:25:00Z"},{"stage":"core","start_time":"2026-06-04T03:25:00Z","end_time":"2026-06-04T07:00:00Z"},{"stage":"deep","start_time":"2026-06-04T07:00:00Z","end_time":"2026-06-04T08:10:00Z"},{"stage":"rem","start_time":"2026-06-04T08:10:00Z","end_time":"2026-06-04T10:25:00Z"},{"stage":"awake","start_time":"2026-06-04T10:25:00Z","end_time":"2026-06-04T10:45:00Z"}]}],"deleted_records":[{"record_family":"sample","source_key":"synthetic.phone.alpha","client_record_id":"synthetic-sample-steps-removed-20260605","deleted_at":"2026-06-05T09:15:00Z"}],"sync":{"sync_window":{"start_time":"2026-06-01T00:00:00Z","end_time":"2026-06-08T00:00:00Z"},"cursors":[]}}
