{
  "schema_id": "health_bridge.batch.v1",
  "schema_version": "1.0.0",
  "generated_at": "2026-06-08T09:00:00Z",
  "export_window": {
    "start_time": "2026-06-01T00:00:00Z",
    "end_time": "2026-06-08T00:00:00Z"
  },
  "sources": [
    {
      "source_key": "synthetic.phone.alpha",
      "name": "Synthetic Phone Alpha",
      "kind": "phone",
      "bundle_id": "com.example.synthetic.healthbridge",
      "device_model": "SyntheticPhone1,1"
    },
    {
      "source_key": "synthetic.watch.bravo",
      "name": "Synthetic Watch Bravo",
      "kind": "watch",
      "bundle_id": "com.example.synthetic.watch",
      "device_model": "SyntheticWatch1,1"
    }
  ],
  "health_types": [
    {
      "type_code": "steps",
      "display_name": "Steps",
      "category": "activity",
      "default_unit": "count",
      "sensitivity": "low",
      "aliases": ["HKQuantityTypeIdentifierStepCount"]
    },
    {
      "type_code": "heart_rate",
      "display_name": "Heart Rate",
      "category": "heart",
      "default_unit": "count/min",
      "sensitivity": "moderate",
      "aliases": ["HKQuantityTypeIdentifierHeartRate"]
    },
    {
      "type_code": "body_mass",
      "display_name": "Body Mass",
      "category": "body",
      "default_unit": "kg",
      "sensitivity": "high",
      "aliases": ["HKQuantityTypeIdentifierBodyMass"]
    },
    {
      "type_code": "sleep_analysis",
      "display_name": "Sleep Analysis",
      "category": "sleep",
      "default_unit": "stage",
      "sensitivity": "moderate",
      "aliases": ["HKCategoryTypeIdentifierSleepAnalysis"]
    }
  ],
  "samples": [
    {
      "client_record_id": "synthetic-sample-steps-20260601",
      "source_key": "synthetic.phone.alpha",
      "type_code": "steps",
      "start_time": "2026-06-01T00:00:00Z",
      "end_time": "2026-06-02T00:00:00Z",
      "value": 4321,
      "unit": "count",
      "metadata": {
        "aggregation": "daily_sum"
      }
    },
    {
      "client_record_id": "synthetic-sample-heart-20260601-1200",
      "source_key": "synthetic.watch.bravo",
      "type_code": "heart_rate",
      "start_time": "2026-06-01T12:00:00Z",
      "end_time": "2026-06-01T12:00:05Z",
      "value": 72,
      "unit": "count/min",
      "metadata": {
        "sampling": "spot"
      }
    },
    {
      "client_record_id": "synthetic-sample-body-mass-20260602",
      "source_key": "synthetic.phone.alpha",
      "type_code": "body_mass",
      "start_time": "2026-06-02T07:30:00Z",
      "end_time": "2026-06-02T07:30:00Z",
      "value": 70.4,
      "unit": "kg",
      "metadata": {
        "entry": "synthetic_manual"
      }
    }
  ],
  "workouts": [
    {
      "client_record_id": "synthetic-workout-walk-20260603",
      "source_key": "synthetic.watch.bravo",
      "workout_type": "walking",
      "start_time": "2026-06-03T18:00:00Z",
      "end_time": "2026-06-03T18:32:00Z",
      "duration_seconds": 1920,
      "energy_kcal": 140.5,
      "distance_meters": 2400
    }
  ],
  "sleep_sessions": [
    {
      "client_record_id": "synthetic-sleep-20260604",
      "source_key": "synthetic.watch.bravo",
      "start_time": "2026-06-04T03:10:00Z",
      "end_time": "2026-06-04T10:45:00Z",
      "stage_intervals": [
        {
          "stage": "in_bed",
          "start_time": "2026-06-04T03:10:00Z",
          "end_time": "2026-06-04T03:25:00Z"
        },
        {
          "stage": "core",
          "start_time": "2026-06-04T03:25:00Z",
          "end_time": "2026-06-04T07:00:00Z"
        },
        {
          "stage": "deep",
          "start_time": "2026-06-04T07:00:00Z",
          "end_time": "2026-06-04T08:10:00Z"
        },
        {
          "stage": "rem",
          "start_time": "2026-06-04T08:10:00Z",
          "end_time": "2026-06-04T10:25:00Z"
        },
        {
          "stage": "awake",
          "start_time": "2026-06-04T10:25:00Z",
          "end_time": "2026-06-04T10:45:00Z"
        }
      ]
    }
  ],
  "deleted_records": [
    {
      "record_family": "sample",
      "source_key": "synthetic.phone.alpha",
      "client_record_id": "synthetic-sample-steps-removed-20260605",
      "deleted_at": "2026-06-05T09:15:00Z"
    }
  ],
  "sync": {
    "sync_window": {
      "start_time": "2026-06-01T00:00:00Z",
      "end_time": "2026-06-08T00:00:00Z"
    },
    "cursors": [
      {
        "source_key": "synthetic.phone.alpha",
        "cursor_kind": "anchored_object_query",
        "cursor_value": "synthetic-cursor-phone-alpha-0001"
      },
      {
        "source_key": "synthetic.watch.bravo",
        "cursor_kind": "anchored_object_query",
        "cursor_value": "synthetic-cursor-watch-bravo-0001"
      }
    ]
  }
}
